{
  "schema_version": "1.0.0",
  "combination_key": "synthetic-alpha-east-bf16",
  "display_name": "Synthetic Alpha East BF16",
  "resource_refs": {
    "gpu": "advisor_resource_00000000-0000-4000-8000-000000000001",
    "cloud_instance": "advisor_resource_00000000-0000-4000-8000-000000000002",
    "region": "advisor_resource_00000000-0000-4000-8000-000000000003",
    "network_path": "advisor_resource_00000000-0000-4000-8000-000000000004",
    "software_stacks": ["advisor_resource_00000000-0000-4000-8000-000000000005"],
    "pricing_offers": ["advisor_resource_00000000-0000-4000-8000-000000000006"]
  },
  "configuration": {
    "precision": "BF16",
    "topology": "single_node",
    "gpu_count": 8,
    "instance_count": 1,
    "replica_count": 1
  }
}
